{
  "$schema": "https://json-schema.org/draft/2020-12/schema",
  "$id": "https://stemmio.local/schemas/project-state.v3.schema.json",
  "title": "Stemmio project state v3",
  "description": "Durable project identity, readable storage locator and source-lineage cache. Active runs and locks are deliberately excluded and belong only to runtime-state.json.",
  "type": "object",
  "additionalProperties": false,
  "required": [
    "schemaVersion",
    "projectId",
    "documentId",
    "displayName",
    "createdAt",
    "storageDirectoryName",
    "sourcePath",
    "latestVersionId",
    "currentBasedOnVersionId",
    "currentExactVersionId",
    "currentHtmlSha256",
    "lastModifiedAt"
  ],
  "properties": {
    "schemaVersion": {
      "const": "3.0.0"
    },
    "projectId": {
      "$ref": "#/$defs/projectId"
    },
    "documentId": {
      "$ref": "#/$defs/documentId"
    },
    "displayName": {
      "type": "string",
      "minLength": 1,
      "maxLength": 300
    },
    "createdAt": {
      "$ref": "#/$defs/timestamp"
    },
    "storageDirectoryName": {
      "type": "string",
      "minLength": 1,
      "maxLength": 240,
      "pattern": "^(?:.+__[0-9]{8}-[0-9]{6}__[a-f0-9]{8,32}|project_[A-Za-z0-9_-]+)$",
      "description": "Immutable managed-directory locator. New projects use a readable timestamped name; verified Stemmio 0.9.0 v3 projects retain their projectId directory during the additive metadata upgrade."
    },
    "sourcePath": {
      "type": "string",
      "minLength": 1,
      "maxLength": 4096
    },
    "latestVersionId": {
      "$ref": "#/$defs/versionId"
    },
    "currentBasedOnVersionId": {
      "$ref": "#/$defs/versionId"
    },
    "currentExactVersionId": {
      "oneOf": [
        {
          "$ref": "#/$defs/versionId"
        },
        {
          "type": "null"
        }
      ]
    },
    "restoredFromVersionId": {
      "oneOf": [
        {
          "$ref": "#/$defs/versionId"
        },
        {
          "type": "null"
        }
      ],
      "description": "Persistent audit marker for the history Version last restored into the editable source. It is cleared after a successful AI Version commit."
    },
    "currentHtmlSha256": {
      "$ref": "#/$defs/sha256"
    },
    "lastModifiedAt": {
      "$ref": "#/$defs/timestamp"
    }
  },
  "$defs": {
    "projectId": {
      "type": "string",
      "pattern": "^project_[A-Za-z0-9_-]+$"
    },
    "documentId": {
      "type": "string",
      "pattern": "^doc_[A-Za-z0-9_-]+$"
    },
    "versionId": {
      "type": "string",
      "pattern": "^ver_[0-9]{4,}$"
    },
    "timestamp": {
      "type": "string",
      "format": "date-time"
    },
    "sha256": {
      "type": "string",
      "pattern": "^sha256:[a-f0-9]{64}$"
    }
  }
}
