{
  "schemaVersion": "3.0.0",
  "projectId": "project_metrics",
  "documentId": "doc_dashboard",
  "displayName": "AI 指标系统",
  "createdAt": "2026-07-17T08:30:00Z",
  "storageDirectoryName": "AI 指标系统__20260717-163000__abcdef12",
  "sourcePath": "/Users/example/Documents/ai-metrics-system.html",
  "latestVersionId": "ver_0008",
  "currentBasedOnVersionId": "ver_0005",
  "currentExactVersionId": null,
  "restoredFromVersionId": "ver_0005",
  "currentHtmlSha256": "sha256:bbbbbbbbbbbbbbbbbbbbbbbbbbbbbbbbbbbbbbbbbbbbbbbbbbbbbbbbbbbbbbbb",
  "lastModifiedAt": "2026-07-17T08:33:58Z"
}
